[
  {
    "name": "pnp-powerplatform-samples-charts-4-powerapps",
    "source": "pnp",
    "title": "Charts 4 PowerApps",
    "shortDescription": "Chart4PowerApps is a versatile demo app offering a collection of ready-to-use chart components, enabling you to create professional, data-driven visuals effortlessly—without complex development.",
    "url": "https://github.com/pnp/powerplatform-samples/tree/main/samples/charts-4-powerapps",
    "downloadUrl": "https://pnp.github.io/download-partial/?url=https://github.com/pnp/powerplatform-samples/tree/main/samples/charts-4-powerapps",
    "longDescription": [
      "Chart4PowerApps is a versatile demo app offering a collection of ready-to-use chart components, enabling you to create professional, data-driven visuals effortlessly—without complex development."
    ],
    "creationDateTime": "2025-03-02",
    "updateDateTime": "2025-03-02",
    "products": [
      "Power Apps",
      "Power Fx",
      "Power Platform"
    ],
    "tags": [
      "charts"
    ],
    "categories": [
      "CANVAS"
    ],
    "metadata": [
      {
        "key": "POWERAPPS-EXPERIMENTAL",
        "value": "No"
      },
      {
        "key": "POWERAPPS-PREMIUM",
        "value": "No"
      },
      {
        "key": "POWERAPPS-ONPREM",
        "value": "No"
      },
      {
        "key": "POWERAPPS-CUSTOMCONNECTOR",
        "value": "No"
      }
    ],
    "thumbnails": [
      {
        "type": "image",
        "order": 100,
        "url": "https://github.com/pnp/powerplatform-samples/raw/main/samples/charts-4-powerapps/assets/Charts4PAPPS-1.png",
        "alt": "App preview"
      }
    ],
    "authors": [
      {
        "gitHubAccount": "Samir-Daoudi",
        "pictureUrl": "https://github.com/Samir-Daoudi.png",
        "name": "Samir Daoudi"
      }
    ],
    "references": [
      {
        "name": "Microsoft Power Platform documentation",
        "description": "Discover how to make the most of Microsoft Power Platform products with online training courses, docs, and videos covering product capabilities and how-to guides.",
        "url": "https://learn.microsoft.com/power-platform/"
      }
    ]
  }
]