[
  {
    "$schema": "https://developer.microsoft.com/en-us/json-schemas/pnp/samples/v1.0/metadata-schema.json",
    "name": "pnp-powerapps-samples-sharepoint-followsites",
    "version": "1.0.0.0",
    "source": "pnp",
    "creationDateTime": "2023-01-11T00:00:00.000Z",
    "updateDateTime": "2023-01-11T00:00:00.000Z",
    "title": "SharePoint Follow/Discover Sites",
    "shortDescription": "Power Apps solution designed to be embedded within a SharePoint site/page as a Web Part. It is designed as an alternative to the out of the box 'Sites' Web Part.",
    "longDescription": [
      "Power Apps solution designed to be embedded within a SharePoint site/page as a Web Part. It is designed as an alternative to the out of the box 'Sites' Web Part."
    ],
    "url": "https://github.com/pnp/powerplatform-samples/tree/main/samples/sharepoint-followsites",
    "products": [
      "Power Apps",
      "Power Platform"
    ],
    "tags": [
      "POWERAPPS","TEMPALTE"
    ],
    "categories": [
      "POWERAPPS"
    ],
    "metadata": [
      {
        "key": "POWERAPPS-MANIFEST-VERSION",
        "value": "0.20"
      },
      {
        "key": "POWERAPPS-TYPE",
        "value": "Canvas"
      },
      {
        "key": "POWERAPPS-EXPERIMENTAL",
        "value": "No"
      },
      {
        "key": "POWERAPPS-PREMIUM",
        "value": "No"
      },
      {
        "key": "POWERAPPS-ONPREM",
        "value": "No"
      },
      {
        "key": "POWERAPPS-CUSTOMCONNECTOR",
        "value": "No"
      }
    ],
    "thumbnails": [
      {
        "type": "image",
        "order": 100,
        "url": "https://github.com/pnp/powerplatform-samples/blob/main/samples/sharepoint-followsites/assets/preview.png?raw=true",
        "alt": "Preview"
      }
    ],
    "authors": [
      {
        "gitHubAccount": "alexc-MSFT",
        "name": "Alex Clark",
        "pictureUrl": "https://github.com/alexc-MSFT"
      }
    ],
    "references": [
      {
        "name": "Create a component for canvas apps",
        "description": "Components are reusable building blocks for canvas apps so that app makers can create custom controls to use inside an app, or across apps using a component library",
        "url": "https://docs.microsoft.com/powerapps/maker/canvas-apps/"
      },
      {
        "name": "Overview of creating apps in Power Apps",
        "description": "Power Apps is a high-productivity development platform for business apps.",
        "url": "https://docs.microsoft.com/powerapps/maker/"
      },
      {
        "name": "Power Apps canvas apps documentation",
        "description": "Design and build a business app from a canvas in Microsoft Power Apps with data from a variety of sources without writing any code using traditional programming languages, such as C#.",
        "url": "https://docs.microsoft.com/en-us/powerapps/maker/canvas-apps/"
      }
    ]
  }
]