[
  {
    "name": "pnp-powerplatform-samples-relocation-app",
    "source": "pnp",
    "title": "Relocation App",
    "shortDescription": "Help people settle into a new city with an AI-assisted relocation app, a chatbot, and landmark recognition.",
    "longDescription": [
      "A canvas app helps people starting a new job in an unfamiliar city find workplace and local information through Power Virtual Agents.",
      "AI Builder object detection recognizes landmarks and adds them to a personal collection stored with Dataverse."
    ],
    "url": "https://github.com/pnp/powerplatform-samples/tree/main/samples/relocation-app",
    "creationDateTime": "2023-09-24",
    "updateDateTime": "2023-11-19",
    "products": ["Power Apps", "Power Virtual Agents", "Dataverse", "AI Builder", "Power Platform"],
    "categories": ["CANVAS", "CHATBOT"],
    "tags": ["relocation", "landmarks", "object detection"],
    "metadata": [
      { "key": "POWERAPPS-PREMIUM", "value": "Yes" },
      { "key": "POWERAPPS-EXPERIMENTAL", "value": "No" }
    ],
    "thumbnails": [
      {
        "type": "image",
        "order": 100,
        "url": "https://github.com/pnp/powerplatform-samples/raw/main/samples/relocation-app/assets/screenshot.PNG",
        "alt": "Relocation App overview"
      },
      {
        "type": "image",
        "order": 101,
        "url": "https://github.com/pnp/powerplatform-samples/raw/main/samples/relocation-app/assets/ChatBot.PNG",
        "alt": "Relocation chatbot answering workplace questions"
      }
    ],
    "authors": [
      { "gitHubAccount": "denisamihai", "name": "Denisa Mihai", "pictureUrl": "https://github.com/denisamihai.png" }
    ],
    "references": [
      { "name": "Microsoft Power Platform documentation", "url": "https://learn.microsoft.com/power-platform/" }
    ]
  }
]
