[
  {
    "name": "pnp-powerplatform-samples-reusable-childflow-array-operations",
    "source": "pnp",
    "title": "Reusable Child flow for Array Operations",
    "shortDescription": "This sample is a reusable cloud flow that can be used for performing Union (All), Intersection (Common) & Difference (Array1-Array2) operation on input JSON arrays.",
    "url": "https://github.com/pnp/powerplatform-samples/tree/main/samples/reusable-childflow-array-operations",
    "downloadUrl": "https://pnp.github.io/download-partial/?url=https://github.com/pnp/powerplatform-samples/tree/main/samples/reusable-childflow-array-operations",
    "longDescription": [
      "This sample is a reusable cloud flow that can be used for performing Union (All), Intersection (Common) & Difference (Array1-Array2) operation on input JSON arrays."
    ],
    "creationDateTime": "2024-08-24",
    "updateDateTime": "2024-08-24",
    "products": [
      "Power Automate",
      "Power Platform"
    ],
    "tags": [
      "reusable flow",
      "array operations"
    ],
    "categories": [
      "CLOUD-FLOW"
    ],
    "metadata": [
      {
        "key": "POWERAPPS-EXPERIMENTAL",
        "value": "No"
      },
      {
        "key": "POWERAPPS-PREMIUM",
        "value": "No"
      },
      {
        "key": "POWERAPPS-ONPREM",
        "value": "No"
      },
      {
        "key": "POWERAPPS-CUSTOMCONNECTOR",
        "value": "No"
      }
    ],
    "thumbnails": [
      {
        "type": "image",
        "order": 100,
        "url": "https://github.com/pnp/powerplatform-samples/raw/main/samples/reusable-childflow-array-operations/assets/flow-overview.png",
        "alt": "Flow overview"
      }
    ],
    "authors": [
      {
        "gitHubAccount": "Solanki-Manish",
        "pictureUrl": "https://github.com/Solanki-Manish.png",
        "name": "Manish Solanki"
      }
    ],
    "references": [
      {
        "name": "Microsoft Power Platform documentation",
        "description": "Discover how to make the most of Microsoft Power Platform products with online training courses, docs, and videos covering product capabilities and how-to guides.",
        "url": "https://learn.microsoft.com/power-platform/"
      }
    ]
  }
]