[
  {
    "name": "pnp-powerplatform-samples-apptemplate",
    "source": "pnp",
    "title": "Power App template with reusable header, footer & left navigation",
    "shortDescription": "This tablet-based canvas app helps to kickstart the development in Power Apps using reusable header, footer and left navigation components.",
    "url": "https://github.com/pnp/powerplatform-samples/tree/main/samples/apptemplate",
    "downloadUrl": "https://pnp.github.io/download-partial/?url=https://github.com/pnp/powerplatform-samples/tree/main/samples/apptemplate",
    "longDescription": [
      "This tablet-based canvas app helps to kickstart the development in Power Apps using reusable header, footer and left navigation components."
    ],
    "creationDateTime": "2025-02-23",
    "updateDateTime": "2025-02-23",
    "products": [
      "Power Apps",
      "Power Platform"
    ],
    "tags": [
      "Reusable app components"
    ],
    "categories": [
      "CANVAS"
    ],
    "metadata": [
      {
        "key": "POWERAPPS-EXPERIMENTAL",
        "value": "No"
      },
      {
        "key": "POWERAPPS-PREMIUM",
        "value": "No"
      },
      {
        "key": "POWERAPPS-ONPREM",
        "value": "No"
      },
      {
        "key": "POWERAPPS-CUSTOMCONNECTOR",
        "value": "No"
      }
    ],
    "thumbnails": [
      {
        "type": "image",
        "order": 100,
        "url": "https://github.com/pnp/powerplatform-samples/raw/main/samples/apptemplate/assets/header-footer-leftnavigation.png",
        "alt": "App preview"
      }
    ],
    "authors": [
      {
        "gitHubAccount": "vipulj03",
        "pictureUrl": "https://github.com/vipulj03.png",
        "name": "Vipul Jain"
      }
    ],
    "references": [
      {
        "name": "Microsoft Power Platform documentation",
        "description": "Discover how to make the most of Microsoft Power Platform products with online training courses, docs, and videos covering product capabilities and how-to guides.",
        "url": "https://learn.microsoft.com/power-platform/"
      }
    ]
  }
]