[
  {
    "name": "pnp-powerplatform-samples-cascading-dropdown-component",
    "source": "pnp",
    "title": "Cascading Dropdown Component",
    "shortDescription": "Power Apps Canvas Component for two-level cascading dropdowns",
    "url": "https://github.com/pnp/powerplatform-samples/tree/main/samples/cascading-dropdown-component",
    "downloadUrl": "https://pnp.github.io/download-partial/?url=https://github.com/pnp/powerplatform-samples/tree/main/samples/calendar-component",
    "longDescription": [
      "Power Apps Canvas Component for two-level cascading dropdowns."
    ],
    "creationDateTime": "2022-10-29",
    "updateDateTime": "2025-07-15",
    "products": [
      "Power Apps",
      "Power Platform",
      "PowerPlatform-samples"
    ],
    "tags": [
      "Power Apps","Component","Canvas", "Cascading", "Dropdown"
    ],
    "categories": [
      "CANVAS"
    ],
    "metadata": [
      {
        "key": "POWERAPPS-EXPERIMENTAL",
        "value": "No"
      },
      {
        "key": "POWERAPPS-PREMIUM",
        "value": "No"
      },
      {
        "key": "POWERAPPS-ONPREM",
        "value": "No"
      },
      {
        "key": "POWERAPPS-CUSTOMCONNECTOR",
        "value": "No"
      }
    ],
    "thumbnails": [
      {
        "type": "image",
        "order": 100,
        "url": "https://github.com/pnp/powerplatform-samples/raw/main/samples/calendar-component/assets/preview.png",
        "alt": "Preview PNG"
      }
    ],
    "authors": [
      {
        "gitHubAccount": "aprildunnam",
        "name": "April Dunnam",
        "pictureUrl": "https://github.com/aprildunnam.png"
      }
    ],
    "references": [
      {
        "name": "Overview of creating apps in Power Apps",
        "description": "Power Apps is a high-productivity development platform for business apps.",
        "url": "https://docs.microsoft.com/powerapps/maker/"
      },
      {
        "name": "Power Apps canvas apps documentation",
        "description": "Design and build a business app from a canvas in Microsoft Power Apps with data from a variety of sources without writing any code using traditional programming languages, such as C#.",
        "url": "https://docs.microsoft.com/en-us/powerapps/maker/canvas-apps/"
      }
    ]
  }
]