[
  {
    "name": "pnp-powerplatform-samples-YOUR-SAMPLE-NAME",
    "source": "pnp",
    "title": "YOUR-SAMPLE-TITLE",
    "shortDescription": "YOUR-SHORT-DESCRIPTION",
    "url": "https://github.com/pnp/powerplatform-samples/tree/main/samples/YOUR-SAMPLE-NAME",
    "downloadUrl": "https://pnp.github.io/download-partial/?url=https://github.com/pnp/powerplatform-samples/tree/main/samples/YOUR-SAMPLE-NAME",
    "longDescription": [
      "YOUR-SHORT-DESCRIPTION"
    ],
    "creationDateTime": "2023-12-25",
    "updateDateTime": "2023-12-31",
    "products": [
      "Power Apps",
      "Power Automate",
      "Copilot Studio",
      "Power Fx",
      "Power Pages",
      "Power Apps Component Framework",
      "Power Platform"
    ],
    "tags": [
      "Tag1",
      "Tag2"
    ],
    "categories": [
      "CANVAS",
      "MODEL-DRIVEN",
      "DESKTOP-FLOW",
      "CLOUD-FLOW",
      "COMPONENT-LIBRARY",
      "WEBSITE",
      "CHATBOT"
    ],
    "metadata": [
      {
        "key": "POWERAPPS-EXPERIMENTAL",
        "value": "No"
      },
      {
        "key": "POWERAPPS-PREMIUM",
        "value": "Yes"
      },
      {
        "key": "POWERAPPS-ONPREM",
        "value": "No"
      },
      {
        "key": "POWERAPPS-CUSTOMCONNECTOR",
        "value": "No"
      }
    ],
    "thumbnails": [
      {
        "type": "image",
        "order": 100,
        "url": "https://github.com/pnp/powerplatform-samples/raw/main/samples/YOUR-SAMPLE-NAME/assets/YOUR-IMAGE-NAME-HERE",
        "alt": "App preview"
      },
      {
        "type": "video",
        "order": 101,
        "url": "https://www.youtube.com/embed/FS-_0KENJkI",
        "alt": "Community demo of the sample"
      }
    ],
    "authors": [
      {
        "gitHubAccount": "YOUR-GITHUB-ACCOUNT",
        "pictureUrl": "https://github.com/YOUR-GITHUB-ACCOUNT.png",
        "name": "YOUR-NAME"
      }
    ],
    "references": [
      {
        "name": "Microsoft Power Platform documentation",
        "description": "Discover how to make the most of Microsoft Power Platform products with online training courses, docs, and videos covering product capabilities and how-to guides.",
        "url": "https://learn.microsoft.com/power-platform/"
      }
    ]
  }
]