[
  {
    "name": "pnp-powerplatform-samples-image-creator",
    "source": "pnp",
    "title": "Image Creator / Generator",
    "shortDescription": "This sample allows the user to enter a prompt into a copilot and then it generates an image based on the prompt using the Azure OpenAI Service Dalle-3 model.",
    "url": "https://github.com/pnp/powerplatform-samples/tree/main/samples/image-creator",
    "downloadUrl": "https://pnp.github.io/download-partial/?url=https://github.com/pnp/powerplatform-samples/tree/main/samples/image-creator",
    "longDescription": [
      "This sample allows the user to enter a prompt into a copilot and then it generates an image based on the prompt using the Azure OpenAI Service Dalle-3 model."
    ],
    "creationDateTime": "2024-07-25",
    "updateDateTime": "2024-07-25",
    "products": [
      "Power Automate",
      "Copilot Studio",
      "Custom Connectors",
      "Power Platform"
    ],
    "tags": [
      "Image",
      "Azure OpenAI"
    ],
    "categories": [
      "CLOUD-FLOW",
      "CHATBOT"
    ],
    "metadata": [
      {
        "key": "POWERAPPS-EXPERIMENTAL",
        "value": "No"
      },
      {
        "key": "POWERAPPS-PREMIUM",
        "value": "Yes"
      },
      {
        "key": "POWERAPPS-ONPREM",
        "value": "No"
      },
      {
        "key": "POWERAPPS-CUSTOMCONNECTOR",
        "value": "Yes"
      }
    ],
    "thumbnails": [
      {
        "type": "image",
        "order": 100,
        "url": "https://github.com/pnp/powerplatform-samples/raw/main/samples/image-creator/assets/Sample1.png",
        "alt": "App preview"
      }
    ],
    "authors": [
      {
        "gitHubAccount": "gomomohapi",
        "pictureUrl": "https://github.com/gomomohapi.png",
        "name": "Gomolemo Mohapi"
      }
    ],
    "references": [
      {
        "name": "Microsoft Power Platform documentation",
        "description": "Discover how to make the most of Microsoft Power Platform products with online training courses, docs, and videos covering product capabilities and how-to guides.",
        "url": "https://learn.microsoft.com/power-platform/"
      },
      {
        "name": "Visual Studio connected service",
        "description": "Developers can use Connected Services within Visual Studio to create custom connectors. Connected Services is a collection of tools in Visual Studio that help you connect to services.",
        "url": "https://learn.microsoft.com/en-us/power-platform/developer/visual-studio-connected-service"
      }
    ]
  }
]