[
  {
    "name": "pnp-powerplatform-samples-embed-image-in-email-body",
    "source": "pnp",
    "title": "Embed Image In Email Body",
    "shortDescription": "This sample gets an image content from SharePoint document library and embed in it email body to share it with recipient(s).",
    "url": "https://github.com/pnp/powerplatform-samples/tree/main/samples/embed-image-in-email-body",
    "downloadUrl": "https://pnp.github.io/download-partial/?url=https://github.com/pnp/powerplatform-samples/tree/main/samples/embed-image-in-email-body",
    "longDescription": [
      "This sample gets an image content from SharePoint document library and embed in it email body to share it with recipient(s). The flow calls graph API by utilizing premium **Invoke an HTTP request** action to overcome size limitation(~1 MB) when embedding image using URI method."
    ],
    "creationDateTime": "2024-07-07",
    "updateDateTime": "2024-07-07",
    "products": [
      "Power Automate",
      "Power Platform"
    ],
    "tags": [
      "email",
      "graph"
    ],
    "categories": [
      "CLOUD-FLOW"
    ],
    "metadata": [
      {
        "key": "POWERAPPS-EXPERIMENTAL",
        "value": "No"
      },
      {
        "key": "POWERAPPS-PREMIUM",
        "value": "Yes"
      },
      {
        "key": "POWERAPPS-ONPREM",
        "value": "No"
      },
      {
        "key": "POWERAPPS-CUSTOMCONNECTOR",
        "value": "No"
      }
    ],
    "thumbnails": [
      {
        "type": "image",
        "order": 100,
        "url": "https://github.com/pnp/powerplatform-samples/raw/main/samples/embed-image-in-email-body/assets/flow-overview.png",
        "alt": "App preview"
      }
    ],
    "authors": [
      {
        "gitHubAccount": "Solanki-Manish",
        "pictureUrl": "https://github.com/Solanki-Manish.png",
        "name": "Manish Solanki"
      }
    ],
    "references": [
      {
        "name": "Microsoft Power Platform documentation",
        "description": "Discover how to make the most of Microsoft Power Platform products with online training courses, docs, and videos covering product capabilities and how-to guides.",
        "url": "https://learn.microsoft.com/power-platform/"
      }
    ]
  }
]