[
  {
    "name": "pnp-powerplatform-samples-alt-text-generator",
    "source": "pnp",
    "title": "Alt Text Generator",
    "shortDescription": "This sample allows the user to enter a link to a .png image into a copilot and then it generates alt text for the image using OpenAI's gpt-4o model.",
    "url": "https://github.com/pnp/powerplatform-samples/tree/main/samples/alt-text-generator",
    "downloadUrl": "https://pnp.github.io/download-partial/?url=https://github.com/pnp/powerplatform-samples/tree/main/samples/alt-text-generator",
    "longDescription": [
      "This sample allows the user to enter a link to a .png image into a copilot and then it generates alt text for the image using OpenAI's gpt-4o model."
    ],
    "creationDateTime": "2024-09-11",
    "updateDateTime": "2024-09-11",
    "products": [
      "Power Automate",
      "Power Virtual Agents",
      "Power Platform"
    ],
    "tags": [
      "Text Generator"
    ],
    "categories": [
      "CLOUD-FLOW",
      "CHATBOT"
    ],
    "metadata": [
      {
        "key": "POWERAPPS-EXPERIMENTAL",
        "value": "Yes"
      },
      {
        "key": "POWERAPPS-PREMIUM",
        "value": "Yes"
      },
      {
        "key": "POWERAPPS-ONPREM",
        "value": "No"
      },
      {
        "key": "POWERAPPS-CUSTOMCONNECTOR",
        "value": "Yes"
      }
    ],
    "thumbnails": [
      {
        "type": "image",
        "order": 100,
        "url": "https://github.com/pnp/powerplatform-samples/raw/main/samples/alt-text-generator/assets/Sample2.png",
        "alt": "App preview"
      }
    ],
    "authors": [
      {
        "gitHubAccount": "gomomohapi",
        "pictureUrl": "https://github.com/gomomohapi.png",
        "name": "Gomolemo Mohapi"
      }
    ],
    "references": [
      {
        "name": "Microsoft Power Platform documentation",
        "description": "Discover how to make the most of Microsoft Power Platform products with online training courses, docs, and videos covering product capabilities and how-to guides.",
        "url": "https://learn.microsoft.com/power-platform/"
      }
    ]
  }
]