[
    {
      "name": "pnp-powerplatform-samples-timeline-component",
      "source": "pnp",
      "title": "Timeline Component for Canvas apps",
      "shortDescription": "A Canvas app version of the timeline feature in a Model-Driven app, this component consolidates all the activities of a contact or account in a single timleine view, just like an MDA.",
      "url": "https://github.com/pnp/powerplatform-samples/tree/main/samples/timeline-component",
      "downloadUrl": "https://pnp.github.io/download-partial/?url=https://github.com/pnp/powerplatform-samples/tree/main/samples/timeline-component",
      "longDescription": [
        "This timeline component collects Notes, Emails, Appointments, Phone Calls and Tasks created as activities for a contact or account and displays them in a single timeline view, similar to the timeline feature in Model-Driven apps. The component is designed to be used in a Canvas app, and it can be customised to fit your specific needs and include addtiional activity tables."
      ],
      "creationDateTime": "2025-04-25",
      "updateDateTime": "2025-04-25",
      "products": [
        "Power Apps",
        "Power Platform",
        "Dataverse"
      ],
      "tags": [
        "template",
        "activities"
      ],
      "categories": [
        "CANVAS"
      ],
      "metadata": [
        {
          "key": "POWERAPPS-EXPERIMENTAL",
          "value": "No"
        },
        {
          "key": "POWERAPPS-PREMIUM",
          "value": "Yes"
        },
        {
          "key": "POWERAPPS-ONPREM",
          "value": "No"
        },
        {
          "key": "POWERAPPS-CUSTOMCONNECTOR",
          "value": "No"
        }
      ],
      "thumbnails": [
        {
          "type": "image",
          "order": 100,
          "url": "https://github.com/pnp/powerplatform-samples/raw/main/samples/timeline-component/assets/AccountTimelineRelated.png",
          "alt": "Timeline Component"
        }
      ],
      "authors": [
        {
            "gitHubAccount": "NatiTurts",
            "pictureUrl": "https://github.com/NatiTurts.png",
            "name": "Nati Turtledove"
        }
      ],
      "references": [
        {
          "name": "Microsoft Power Platform documentation",
          "description": "Discover how to make the most of Microsoft Power Platform products with online training courses, docs, and videos covering product capabilities and how-to guides.",
          "url": "https://learn.microsoft.com/power-platform/"
        }
      ]
    }
  ]