[
  {
    "name": "pnp-powerplatform-samples-calendar-component",
    "source": "pnp",
    "title": "Calendar Component",
    "shortDescription": "A re-usable component that allows you to display events in  a calendar.",
    "url": "https://github.com/pnp/powerplatform-samples/tree/main/samples/calendar-component",
    "downloadUrl": "https://pnp.github.io/download-partial/?url=https://github.com/pnp/powerplatform-samples/tree/main/samples/calendar-component",
    "longDescription": [
      "A re-usable component that allows you to display events in  a calendar."
    ],
    "creationDateTime": "2021-05-05",
    "updateDateTime": "2025-07-15",
    "products": [
      "Power Apps",
      "Power Platform",
      "PowerPlatform-samples"
    ],
    "tags": [
      "CALENDAR", "COMPONENT"
    ],
    "categories": [
      "CANVAS"
    ],
    "metadata": [
      {
        "key": "POWERAPPS-EXPERIMENTAL",
        "value": "No"
      },
      {
        "key": "POWERAPPS-PREMIUM",
        "value": "No"
      },
      {
        "key": "POWERAPPS-ONPREM",
        "value": "No"
      },
      {
        "key": "POWERAPPS-CUSTOMCONNECTOR",
        "value": "No"
      }
    ],
    "thumbnails": [
      {
        "type": "image",
        "order": 100,
        "url": "https://github.com/pnp/powerplatform-samples/raw/main/samples/calendar-component/assets/preview.png",
        "alt": "Preview PNG"
      }
    ],
    "authors": [
      {
        "gitHubAccount": "aprildunnam",
        "name": "April Dunnam",
        "pictureUrl": "https://github.com/aprildunnam.png"
      }
    ],
    "references": [
      {
        "name": "Create a component for canvas apps",
        "description": "Components are reusable building blocks for canvas apps so that app makers can create custom controls to use inside an app, or across apps using a component library",
        "url": "https://docs.microsoft.com/powerapps/maker/canvas-apps/"
      },
      {
        "name": "Overview of creating apps in Power Apps",
        "description": "Power Apps is a high-productivity development platform for business apps.",
        "url": "https://docs.microsoft.com/powerapps/maker/"
      },
      {
        "name": "Power Apps canvas apps documentation",
        "description": "Design and build a business app from a canvas in Microsoft Power Apps with data from a variety of sources without writing any code using traditional programming languages, such as C#.",
        "url": "https://docs.microsoft.com/en-us/powerapps/maker/canvas-apps/"
      }
    ]
  }
]