[
  {
    "name": "pnp-powerplatform-samples-notify-team-of-unresponsive-channel-post",
    "source": "pnp",
    "title": "Notify team of unresponsive channel post",
    "shortDescription": "This sample sends reminder notification to teams for unresponsive message post in Microsoft teams channel.",
    "url": "https://github.com/pnp/powerplatform-samples/tree/main/samples/notify-team-of-unresponsive-channel-post",
    "downloadUrl": "https://pnp.github.io/download-partial/?url=https://github.com/pnp/powerplatform-samples/tree/main/samples/notify-team-of-unresponsive-channel-post",
    "longDescription": [
      "This sample sends reminder notification alert for an unresponsive channel post to the concern team after a specified period of time internal."
    ],
    "creationDateTime": "2025-02-01",
    "updateDateTime": "2025-02-01",
    "products": [
      "Power Automate",
      "Power Platform",
      "Microsoft Teams"
    ],
    "tags": [
      "message",
      "graph",
      "automation",
      "reminder"
    ],
    "categories": [
      "CLOUD-FLOW"
    ],
    "metadata": [
      {
        "key": "POWERAPPS-EXPERIMENTAL",
        "value": "No"
      },
      {
        "key": "POWERAPPS-PREMIUM",
        "value": "No"
      },
      {
        "key": "POWERAPPS-ONPREM",
        "value": "No"
      },
      {
        "key": "POWERAPPS-CUSTOMCONNECTOR",
        "value": "No"
      }
    ],
    "thumbnails": [
      {
        "type": "image",
        "order": 100,
        "url": "https://github.com/pnp/powerplatform-samples/raw/main/samples/notify-team-of-unresponsive-channel-post/assets/flow-overview.png",
        "alt": "App preview"
      }
    ],
    "authors": [
      {
        "gitHubAccount": "Solanki-Manish",
        "pictureUrl": "https://github.com/Solanki-Manish.png",
        "name": "Manish Solanki"
      }
    ],
    "references": [
      {
        "name": "Microsoft Power Platform documentation",
        "description": "Discover how to make the most of Microsoft Power Platform products with online training courses, docs, and videos covering product capabilities and how-to guides.",
        "url": "https://learn.microsoft.com/power-platform/"
      }
    ]
  }
]