[
  {
    "$schema": "https://developer.microsoft.com/en-us/json-schemas/pnp/samples/v1.0/metadata-schema.json",
    "name": "pnp-powerplatform-samples-prompt-wagon",
    "version": "1.0.0.0",
    "source": "pnp",
    "creationDateTime": "2023-11-10T00:00:00.000Z",
    "updateDateTime": "2023-11-10T00:00:00.000Z",
    "title": "Prompt Wagon",
    "shortDescription": "This app is designed for organizations seeking to seamlessly integrate AI technologies, with features catering to beginners and administrators.",
    "longDescription": [
      "This app is designed for organizations seeking to seamlessly integrate AI technologies, with features catering to beginners and administrators."
    ],
    "url": "https://github.com/pnp/powerplatform-samples/tree/main/samples/prompt-wagon",
    "products": [
      "Power Apps",
      "Power Platform"
    ],
    "tags": [
      "prompts",
      "AI",
      "GPT",
      "copilot"
    ],
    "categories": [
      "POWERAPPS"
    ],
    "metadata": [
      {
        "key": "POWERAPPS-MANIFEST-VERSION",
        "value": "0.20"
      },
      {
        "key": "POWERAPPS-TYPE",
        "value": "Canvas"
      },
      {
        "key": "POWERAPPS-EXPERIMENTAL",
        "value": "No"
      },
      {
        "key": "POWERAPPS-PREMIUM",
        "value": "Yes"
      },
      {
        "key": "POWERAPPS-ONPREM",
        "value": "No"
      },
      {
        "key": "POWERAPPS-CUSTOMCONNECTOR",
        "value": "Yes"
      }
    ],
    "thumbnails": [
      {
        "type": "image",
        "order": 100,
        "url": "https://github.com/pnp/powerplatform-samples/raw/main/samples/prompt-wagon/assets/PromptWagonScreenshot.png",
        "alt": "Preview"
      }
    ],
    "authors": [
      {
        "gitHubAccount": "ArtemChern",
        "name": "Artem Chernevskiy",
        "pictureUrl": "https://github.com/ArtemChern.png"
      }
    ],
    "references": [
      {
        "name": "Azure OpenAI Service",
        "description": "Azure OpenAI Service",
        "url": "https://azure.microsoft.com/products/ai-services/openai-service"
      }
    ]
  }
]
