[
  {
    "name": "pnp-powerplatform-samples-convert-sharepoint-library-doc-file-to-pdf",
    "source": "pnp",
    "title": "Convert sharepoint library document file to pdf",
    "shortDescription": "his sample shows how to convert a doc file to a pdf in the document library.",
    "url": "https://github.com/pnp/powerplatform-samples/tree/main/samples/convert-sharepoint-library-doc-file-to-pdf",
    "downloadUrl": "https://pnp.github.io/download-partial/?url=https://github.com/pnp/powerplatform-samples/tree/main/samples/convert-sharepoint-library-doc-file-to-pdf",
    "longDescription": [
      "This sample shows how to convert a doc file to a pdf in the document library."
    ],
    "creationDateTime": "2022-09-20",
    "updateDateTime": "2025-10-07",
    "products": [
      "Power Automate",
      "PowerPlatform-samples"
    ],
    "tags": [
      "SHAREPOINT", "PERMISSIONS"
    ],
    "categories": [
      "CLOUD-FLOW"
    ],
    "metadata": [
      {
        "key": "POWERAPPS-EXPERIMENTAL",
        "value": "No"
      },
      {
        "key": "POWERAPPS-PREMIUM",
        "value": "No"
      },
      {
        "key": "POWERAPPS-ONPREM",
        "value": "No"
      },
      {
        "key": "POWERAPPS-CUSTOMCONNECTOR",
        "value": "No"
      }
    ],
    "thumbnails": [
      {
        "type": "image",
        "order": 100,
        "url": "https://github.com/pnp/powerplatform-samples/raw/main/samples/convert-sharepoint-library-doc-file-to-pdf/assets/flow.png?raw=true",
        "alt": "Preview PNG"
      }
    ],
    "authors": [
      {
        "gitHubAccount": "chandaniprajapati",
        "name": "Chandani Prajapati",
        "pictureUrl": "https://avatars.githubusercontent.com/u/52065929?v=4"
      }
    ],
    "references": [
        {
            "name": "Create your first flow",
            "description": "Anyone from a basic business user to an IT professional can create automated processes using Power Automate's no-code/low-code platform.",
            "url": "https://docs.microsoft.com/en-us/power-automate/getting-started#create-your-first-flow"
        },
        {
            "name": "Microsoft Power Automate documentation",
            "description": "Power Automate is a service that helps you create automated workflows between your favorite apps and services to synchronize files, get notifications, collect data, and more.",
            "url": "https://docs.microsoft.com/en-us/power-automate/"
        }
    ]
  }
]
