[
  {
    "name": "pnp-powerplatform-samples-create-folder-with-link-back-to-list",
    "source": "pnp",
    "title": "Create folder with link back to list",
    "shortDescription": "This sample creates a folder in a SharePoint document library and then stores the link to the newly created folder inside of Microsoft Lists using Power Automate.",
    "url": "https://github.com/pnp/powerplatform-samples/tree/main/samples/create-folder-with-link-back-to-list",
    "downloadUrl": "https://pnp.github.io/download-partial/?url=https://github.com/pnp/powerplatform-samples/tree/main/samples/create-folder-with-link-back-to-list",
    "longDescription": [
      "This sample demonstrates how to create a folder in a SharePoint document library and store a link to that folder in a Microsoft Lists item using Power Automate.  The folder name is based on a combination of list columns and provides a better link experience compared to the default URL."
    ],
    "creationDateTime": "2022-10-10",
    "updateDateTime": "2025-12-16",
    "products": [
      "Power Automate",
      "PowerPlatform-samples"
    ],
    "tags": [
      "SharePoint", "Folder-URL"
    ],
    "categories": [
      "CLOUD-FLOW"
    ],
    "metadata": [
      {
        "key": "POWERAPPS-EXPERIMENTAL",
        "value": "No"
      },
      {
        "key": "POWERAPPS-PREMIUM",
        "value": "No"
      },
      {
        "key": "POWERAPPS-ONPREM",
        "value": "No"
      },
      {
        "key": "POWERAPPS-CUSTOMCONNECTOR",
        "value": "No"
      }
    ],
    "thumbnails": [
      {
        "type": "image",
        "order": 100,
        "url": "https://github.com/pnp/powerplatform-samples/raw/main/samples/create-folder-with-link-back-to-list/assets/flow-overview.png?raw=true",
        "alt": "Preview PNG"
      }
    ],
    "authors": [
      {
        "gitHubAccount": "nyoung30",
        "name": "Norm Young",
        "pictureUrl": "https://avatars.githubusercontent.com/u/25697904?v=4"
      }
    ],
    "references": [
        {
            "name": "Create your first flow",
            "description": "Anyone from a basic business user to an IT professional can create automated processes using Power Automate's no-code/low-code platform.",
            "url": "https://docs.microsoft.com/en-us/power-automate/getting-started#create-your-first-flow"
        },
        {
            "name": "Microsoft Power Automate documentation",
            "description": "Power Automate is a service that helps you create automated workflows between your favorite apps and services to synchronize files, get notifications, collect data, and more.",
            "url": "https://docs.microsoft.com/en-us/power-automate/"
        },
        {
            "name": "Application Registration in Azure",
            "description": "Application registration would be needed whenever we are trying to access any of the graph APIs",
            "url": "https://docs.microsoft.com/en-us/azure/active-directory/develop/quickstart-configure-app-access-web-apis"
        }
    ]
  }
]
