[
  {
    "name": "pnp-powerplatform-samples-term-buddy",
    "source": "pnp",
    "title": "Term Buddy",
    "shortDescription": "Term Buddy is your AI-powered terminology assistant. It provides clear term definitions, generates quizzes, and offers real-world term usage examples to enhance learning and comprehension.",
    "url": "https://github.com/pnp/powerplatform-samples/tree/main/samples/term-buddy",
    "downloadUrl": "https://pnp.github.io/download-partial/?url=https://github.com/pnp/powerplatform-samples/tree/main/samples/term-buddy",
    "longDescription": [
      "Term Buddy is your AI-powered terminology assistant. It provides clear term definitions, generates quizzes, and offers real-world term usage examples to enhance learning and comprehension."
    ],
    "creationDateTime": "2025-02-28",
    "updateDateTime": "2025-02-28",
    "products": [
      "Power Apps",
      "Power Automate",
      "Power Virtual Agents",
      "Power Fx",
      "Power Platform"
    ],
    "tags": [
      "term",
      "agent"
    ],
    "categories": [
      "CANVAS",
      "CLOUD-FLOW",
      "CHATBOT"
    ],
    "metadata": [
      {
        "key": "POWERAPPS-EXPERIMENTAL",
        "value": "Yes"
      },
      {
        "key": "POWERAPPS-PREMIUM",
        "value": "Yes"
      },
      {
        "key": "POWERAPPS-ONPREM",
        "value": "No"
      },
      {
        "key": "POWERAPPS-CUSTOMCONNECTOR",
        "value": "No"
      }
    ],
    "thumbnails": [
      {
        "type": "image",
        "order": 100,
        "url": "https://github.com/pnp/powerplatform-samples/raw/main/samples/term-buddy/assets/term-buddy-admin-panel.gif",
        "alt": "App preview"
      },
      {
        "type": "video",
        "order": 101,
        "url": "https://www.youtube.com/embed/pSs8emZ-llY",
        "alt": "Term Buddy | Hack Together 2025"
      }
    ],
    "authors": [
      {
        "gitHubAccount": "Katerina-Chernevskaya",
        "pictureUrl": "https://github.com/Katerina-Chernevskaya.png",
        "name": "Katerina Chernevskaya"
      },
      {
        "gitHubAccount": "ArtemChern",
        "pictureUrl": "https://github.com/ArtemChern.png",
        "name": "Artem Chernevskiy"
      }
    ],
    "references": [
      {
        "name": "Microsoft Power Platform documentation",
        "description": "Discover how to make the most of Microsoft Power Platform products with online training courses, docs, and videos covering product capabilities and how-to guides.",
        "url": "https://learn.microsoft.com/power-platform/"
      }
    ]
  }
]