[
  {
    "name": "pnp-powerplatform-samples-contoso-school",
    "source": "pnp",
    "title": "Contoso School",
    "shortDescription": "Send school communications with Power Apps, Azure Communication Services, and AI Builder.",
    "longDescription": [
      "Combine a canvas app, Dataverse parent contact information, AI Builder, and Azure Communication Services to send school communications by email and SMS."
    ],
    "url": "https://github.com/pnp/powerplatform-samples/tree/main/samples/contoso-school",
    "creationDateTime": "2023-04-28",
    "updateDateTime": "2023-04-28",
    "products": ["Power Apps", "Power Automate", "Dataverse", "AI Builder", "Power Platform"],
    "categories": ["CANVAS"],
    "tags": ["school", "communications", "email", "SMS"],
    "metadata": [
      { "key": "POWERAPPS-PREMIUM", "value": "Yes" },
      { "key": "POWERAPPS-EXPERIMENTAL", "value": "No" }
    ],
    "thumbnails": [
      {
        "type": "image",
        "order": 100,
        "url": "https://github.com/pnp/powerplatform-samples/raw/main/samples/contoso-school/assets/contoso-school-1.png",
        "alt": "Contoso School communication entry screen"
      },
      {
        "type": "image",
        "order": 101,
        "url": "https://github.com/pnp/powerplatform-samples/raw/main/samples/contoso-school/assets/contoso-school-2.png",
        "alt": "Contoso School communication alert screen"
      }
    ],
    "authors": [
      { "gitHubAccount": "ddematheu2", "name": "David de Matheu", "pictureUrl": "https://github.com/ddematheu2.png" }
    ],
    "references": [
      { "name": "Microsoft Power Platform documentation", "url": "https://learn.microsoft.com/power-platform/" }
    ]
  }
]
